{
  "schemaVersion": 1,
  "id": "org.lumaforge.lut.neutral-rec709",
  "kind": "lut",
  "format": "cube",
  "version": "1.0.0",
  "title": "Neutral Rec.709",
  "description": "Example first-party LUT manifest.",
  "license": "CC0-1.0",
  "author": "LumaForge contributors",
  "source": "original",
  "sourceUrl": null,
  "redistributionAllowed": true,
  "targets": {},
  "assets": [
    {
      "role": "cube-lut",
      "path": "assets/neutral-rec709.cube",
      "mediaType": "application/x-cube-lut",
      "byteSize": 12345,
      "sha256": "0000000000000000000000000000000000000000000000000000000000000000"
    }
  ],
  "createdAt": "2026-04-28T00:00:00.000Z",
  "updatedAt": "2026-04-28T00:00:00.000Z",
  "lut": {
    "title": "Neutral Rec.709",
    "dimension": "3d",
    "size": 33,
    "domainMin": [0, 0, 0],
    "domainMax": [1, 1, 1],
    "vendor": "lumaforge",
    "inputTransfer": "srgb",
    "inputGamut": "rec709",
    "outputTransfer": "srgb",
    "outputGamut": "rec709",
    "intent": "display-look",
    "family": "lumaforge-examples",
    "variant": "neutral-rec709"
  }
}
